,pub_date,original_title,foreign_title,english_title,author,original_abstract,english_abstract,url
44,2020.06,코로나19 경제위기의 영향과 신앙적 교훈,,A Study on the Influence of the Corona 19 Economic Crisis and the Biblical Lessons,이선복(동서대학교),"2019년 12월 중국 후베이성 우한에서 시작된 COVID-19의 영향으로 국내는 물론 세계경제가 충격을 입고 있다. IMF는 2020년 세계 경제성장률을 -3.0%로 전망하고, 한국도 -1.2%로 예측했다. 본 연구는 COVID-19가 한국 경제에 미친 영향과 이를 극복하기 위해 발표된 정부의 경제정책을 보도 자료를 통해 분석하고 있다. 그리고 그리스도인의 관점에서 COVID-19가 준 교훈을 성경적 관점에서 정리하고, 교회와 성도, 국가 입장에서 필요한 실천사항을 제시하고 있다. 연구 결과는 다음과 같다. 첫째, 통화정책을 통해 기준금리가 0.75%로 하향 조정되고, 유동성 확보를 위한 양적완화가 이루어졌다. 둘째, 재정정책을 통해 전국민 긴급재난지원금과 지방자치단체별 지원금, 기획재정부에 의한 중소기업 및 수출입 지원, 항공등 산업별 지원, 고용유지 지원이 이루어졌다. 셋째, 일본 고베개혁신학교 요시다 다카시의 자료를 인용, 코로나19로 인한 신앙적 교훈을 살펴보고, 교회와 성도, 국가의 성경적 관점 실천사항을 제시하고 있다.","The impact of COVID-19, which began in Wuhan, Hubei Province, China in December 2019, has shocked the global economy as well as Korea. The IMF forecast the global economic growth rate at -3.0 percent in 2020, while Korea also forecast -1.2 percent. The study analyzes the impact of COVID-19 on the Korean economy and the government's economic policies announced to overcome it in a press release. And from the Christian point of view, the lessons given by COVID-19 are arranged from the biblical point of view, and the practices necessary for the church, believers and nations are presented. The results of the study are as follows: Firstly, through monetary policy, the base interest rate was lowered to 0.75%, and quantitative easing was achieved to secure liquidity. Secondly, the government provided support for national civil emergency disaster support, subsidies for each local government, support for small and medium-sized enterprises and exports and imports by the Ministry of Strategy and Finance, support for aviation and other industries, and support for job maintenance through fiscal policies. Lastly, using the presentation materials of Takashi Yoshida of Kobe Reform Theological Seminary in Japan, it examines the biblical lessons of COVID-19, and presents the practice of biblical perspectives of churches, believers and nations.",https://www.kci.go.kr/kciportal/ci/sereArticleSearch/ciSereArtiView.kci?sereArticleSearchBean.artiId=ART002607392
45,2020.06,코로나19의 발생이 중국관광산업에 미치는 영향 및 대응책,,The Phantom and Countermeasures of COVID-19 on the Chinese Tourism Industry,an dong(College of Foreign Languages,"2019년 중국 관광산업의 총규모는 중국 GDP의 11.04%를 차지하고 있어 관광분야의 지속적인 성장은 중국 경제 성장에 종요한 것으로 밝힌다. 관광산업은 예민성을 가지고 있기 때문에 쉽게 위기에 의해 영향을 미친다. 특히 올해 코로나19의 발생 때문에 고성장을 하고 있었던 중국 관광산업에 심각한 영향을 미친 것이 사실이며 전 세계적으로 코로나19가 확산하면서 중국은 정체 상태에 빠지고 관광은 모든 주요 경제 부문에 막대한 영향을 미쳤다. 코로나19는 중국 관광산업에 어떻게 영향 주는 것을 분석하여 영향 메커니즘에 대해 광서비스의 공급불능, 관광의 이동성, 경제의 불경기, 심리적인 요인으로 정리하였다. 위기관리 체계에서 관광산업은 피해의 감소와 신속한 회복을 도모하기 위해 정부의 지원정책(금융지원, 세금감면, 재정지원, 취업유지 등), 협회의 대응책, 기업의 대응책(산업용합, 내부 위기관리 등)을 제시하였다. 대응책에 대해 보환할 여지가 있다. 첫째, 전염병 대응에 더 신속한 조기경보 체계가 필요하다. 둘째, 중소기업의 융자에 대해 지원정책이 필요하다. 셋째, 취업의 유지도 중요하지만 실업자에게 주목할 필요가 있다. 넷째, 재정지원보다 관관기업의 경쟁력을 높여야 된다. 다섯째, 지방 정부의 소비쿠폰 발급을 통해 지역별 불균형의 발전을 보이며 균형적 발전을 위해 중앙정부 차원에 소비쿠폰 발급 정책이 필요하다. 여섯째, 관광산업의 부가가치 증대하기 위해서는 관광산업과 문화산업의 용합, 관광산업과 인터넷의 용합을 기대할 만하다.","China's tourism industry in 2019 accounts for 11.04% of China's GDP. Thus, it is easily seen that the sustained growth of the tourism industry is essential to China's economic growth. Tourism is sensitive, so it is easily affected by crises. Particularly in this year, the worldwide outbreak of COVID-19 has enormously affected of all major economic sectors and had a serious negative impact on the ever fast-growing China's tourism industry, which has brought China's economy to a standstill. The present paper analyzes how COVID-19 affects China's tourism industry and summarizes the impact mechanism by the inability of the supply of optical services, the mobility of tourism, the economic recession, and psychological factors. In the crisis management system, the tourism industry urgently needs the government's support policy (such as financial support, tax reduction, financial support, job maintenance, etc.), the association's countermeasures, and corporate countermeasures (industrial solubility, internal crisis management, etc.) in order to reduce damage and to expedite recovery. There still leaves a lot to do for retribution. Firstly, a faster early warning system is needed to respond to infectious diseases. Secondly, a support policy is needed for loans to small and medium-sized enterprises. Thirdly, maintaining a job is important, but it is worth paying attention to the unemployed. Fourthly, the competitiveness of government-funded companies should be increased rather than merely waiting for financial support. Fifthly, the government should release a policy to issue consumption coupons at the central government level for balanced development, showing the development of regional imbalances through the issuance of consumption coupons by local governments. Lastly, it is worth looking forward to the fusion of tourism and cultural industries, tourism and the Internet in order to increase the added value of tourism industry.",https://www.kci.go.kr/kciportal/ci/sereArticleSearch/ciSereArtiView.kci?sereArticleSearchBean.artiId=ART002600119
46,2020.06,코로나 19 대응 관련 한국의 출입국 제한조치 및 국제법적 평가,The Immigration Restriction Measures of Korea regarding COVID-19 and  Their Assessment under International Law,The Immigration Restriction Measures of Korea regarding COVID-19 and  Their Assessment under International Law,이재유(인천출입국･외국인청장),"2019년부터 코로나 19이라는 국제적 감염병이 급속히 확산되면서, 각국은 자국으로의 유입을 차단하기 위해, 입국금지 등 출입국 제한 조치를 앞 다투어 시행하였다. 더 나아가, 공중보건 역량이 충분하지 못한 개도국 국가들은, 먼저 코로나 19가 확산된 타국으로부터 입국하는 외국인에 대해 전면적인 입국제한 조치를 취하기 시작하였다.
문제는 이러한 각국의 입국제한조치가 세계보건기구(WHO)와 같은 국제기구의 주도적인 조정 없이, 개별 국가들의 방역주권 차원에서 취해지고 있다는 데 있다. 국제사회에서는, 어느 개별국가들에 의해 취해진 다른 국가 국민에 대한 입국제한은, 국제법상 상호주의 법리를 통해, 그에 상응하는 입국제한조치를 야기하는 것이 일반적이다.
이 논문은 코로나 19에 대응하기 위해 우리나라 출입국당국이 시행한 외국인에 대한 출입국 조치들의 현황을 살펴보고, 그에 대한 국제적 감염병 전반을 다루는‘국제보건규칙(2005) 등 국제규범 차원의 평가와 향후 국제공조체제에서의 한국의 역할에 대한 모색을 하고자 하였다.
특히, 최근 국제사회와 세계 언론들이 한국에 대해 코로나 19 사태에 가장 모범적으로 대응하고 있다고 평가하는 가운데, 이러한 국제적 감염병의 국내 유입을 막기 위해 우리나라 출입국당국이 취하였던 출입국 제한조치 현황을 알아보는 것은 상당한 의미가 있다 할 것이다. 특히, 우리나라의 경우, 코로나 19 초기부터 전면적 입국금지 조치를 취하지 않고, 특별검역절차를 포함한 특별입국절차를 시행하면서, 실질적으로 코로나 19의 확산을 효과적으로 차단하는데 성공하였다는 점이다. 또한 그러한 정책의 연장선상에서 국내 입국이후, 체류하는 ‘격리의무 위반’외국인에 대하여는 고의적으로 중대한 위반인 경우, 코로나 확산의 방지를 위해 강제출국을 추진하였다.
이 글에서는 이러한 우리나라의 출입국 제한조치에 대한 국제법적 평가를 논의하는 것이 매우 의미가 있다는 데 중점을 두었다. 이러한 국제규범으로는 WHO가 주도하여 채택된 ‘국제보건규칙(2005)’과 WHO의 권고 등이 있으며, 이러한 평가의 대상은 한국의 공･항만에서의 특별입국절차를 거부하는 외국인에 대한 입국불허, ‘격리의무 위반’ 체류외국인의 강제출국, 체류외국인에 대한 출국기간 연장조치 등이 포함된다.
무엇보다도, 코로나 19 대응을 위한 국제공조체제의 수립이 시급한 데, 우리나라의 검역 및 보건체계 등과 연계된 출입국 조치를 담당하는 출입국당국의 역할이 중요하다고 본다. 국제보건규칙은 ‘인간의 존엄, 인권과 인간의 기본적 자유를 충분히 존중하면서, 국제교통과 운송에 대한 최소한의 간섭이라는 원칙들’을 천명하고 있는데. 우리나라 출입국당국이 이를 출입국업무 현장에서 실행하고 준수하는 것이 중요하다.
결론적으로, 코로나 19와 같은 국제적 감염병에 대한 통제를 위해서, WHO 주도의 국제적 대응은 각국의 국내법적 예방 및 확산 방지 조치들과 긴밀히 연계되는 데 초점이 맞추어져야 한다. 그러기 위해서는 코로나 19에 모범적으로 대처하고 있다는 평을 받고 있는 우리나라가 향후 국제보건규칙(2005)의 개정과 WHO 권고안 마련 시에, 각국이 시행할 ‘출입국 제한조치의 국제표준’을 마련하는데 적극적인 역할을 수행함으로써, 이들 국제규범들이 실질적이면서 효과적으로 국제적 감염병을 통제할 수 있는 방향으로 나아가는 데 기여할 수 있을 것이다.","As COVID-19 rapidly expands from 2019, every country has been initiating the entry-limit measures such as suspension of entry in order to deny the influx of COVID-19.
Meanwhile, the developing countries which do not have enough public health capacity have taken action f full-scale suspension of entry to the people from the countries that COVID-19 have already been spread.
The problem is that such entry-suspension measures, based on disinfection sovereignty, are initiated without the mediation of international organizations such as WHO.
However, one country’s entry-suspension measure can cause another country to respond back with another entry-suspension according to the principles of reciprocity.
This paper investigates Republic of Korea Immigration Bureau’s measures to react to the COVID-19 regarding the Immigration of foreigners, international-level evaluation such as the International Health Regulations(2005) that deals with global infective disease, and the directions on how to approach the issue in future.
As the international society and the world media are praising Republic of Korea’s response to the COVID-19 as the most exemplary one, delving into the current progress of entry-limit policies taken by Republic of Korea Immigration Bureau in order to prevent the influx of global infective disease will have significant meaning.
One remarkable point is that Republic of Korea effectively prevented the spread of COVID-19 by implementing special entry procedure that includes special quarantine procedure, rather than full-scale suspension of entry, since the earlier time of COVID-19’s spread.
Also, as extension of the policy, the immigration authority has pushed ahead the deportation policy for foreigners who entered and are staying in the country if they violate the “quarantine isolation duty”with willful or gross negligence.
This paper evaluated Republic of Korea’s entry-limit measures in the lens of international law, which includes “International Health Regulations(IHR)” and WHO’s recommendations, The concepts that will be evaluated are suspension of entry to the foreigners who refuse to take special entry procedures in Republic of Korea’s airports and seaports “violating the quarantine duty”, and deportation and departure extension measures for staying foreigners.
Above all, the establishment of global mutual aid system to respond to COVID-19 is the to priority. The role of the immigration authority, that is in charge of arrival and departure measures related to quarantine and health system of our country, is anticipated regarding this issue.
The IHR has clarified that the it shall have minimum intervention on international traffic and transportation and shall respect human dignity, human rights, and human’s basic freedom. It is crucial for the immigration authority to implement and execute these principles in sites such as airports and seaports.
In conclusion, to control the global infective disease such as COVID-19, The international response mainly run by WHO should be focused on having strong link with each country’s prevention measures based on their local laws.
For this purpose, Republic of Korea, which is considered the most exemplary in terms of COVID-19 response, should take assertive role of establish “the international standard of entry-limit measures” when the international community propels change in IHR and WHO’s recommendations.
By doing so, Republic of Korea would be able to contribute on the development of international norm to practically and effectively control the global infective disease.",https://www.kci.go.kr/kciportal/ci/sereArticleSearch/ciSereArtiView.kci?sereArticleSearchBean.artiId=ART002605970
47,2020.06,코로나팬더믹 이후 관광산업 발전방안 연구,,A study on the development of the tourism industry of Post-COVID-19 pandemic,김동준(영남이공대학교),"본 연구는 코로나19가 관광 산업체에 미치는 영향을 살펴보고, 포스트 코로나 시대의 발전방안을제시하고자 하였다. 구체적으로 호텔, 여행사, 항공사의 경험이 풍부한 직원을 대상으로 개별 심층인터뷰를 진행하였다. 조사 대상자는 인터뷰에서 제시한 연구문제에 대해 해당업체의 위기적 상황과 해결방안을 응답하였고, 분석결과를 바탕으로 관광 산업체의 운영자에게 비대면 서비스에 대한 근본적인 도움을 주고자 하였다. 연구결과를 바탕으로 포스트 코로나 시대에 관광산업의 발전방안을 제시하면 다음과 같다. 첫째, 언택트 시대의 서비스 상품개발이 중요한데, 관광산업의 특성상 고객을 직접접촉하는 업무로 인해 어려움이 있다. 코로나19 이후 제4차산업혁명의 가속화로 5G, 인공지능, 빅데이터, 증강현실 등의 기술이 급속도로 보급될 것이다. 따라서 관광산업은 이러한 새로운 패러다임과 본질적인 구조개선에 대한 인식이 선행되어야 한다. 둘째, 관광산업의 핵심인 호텔은 상대적으로고가격의 고객들을 대상으로 한다. 먼저, 프런트 데스크의 모습이 전통적인 방식에서 비대면 결재와자동화 시스템으로 변화할 가능성이 크다. 식음료는 인구 밀집도가 낮은 개방형 레스토랑으로, 연회와 컨벤션은 소규모 그룹에게 장소를 대여해 주는 대관사업으로, 외부 케이터링은 소규모 그룹 파티, 홈 파티 등의 고객니즈를 고려한 유망사업으로 변화를 추진해야 할 것이다. 셋째, 여행업은 관광산업의 견인적인 역할을 하고 항공사와 밀접한 관련을 가지고 있다. 단기적으로는 국내 여행업의 활성화가 필요한데, 코로나19 이전과는 완전히 달라질 뉴 노멀(New Normal) 관광시장을 대비하여야 한다.
그리고 핵심 키워드로 웰니스 관광, 체류형 관광, 레저 및 액티비티 등을 내세운 적극적 추진이 필요하다. 넷째, 항공사는 관광산업의 중추적 유통자로서 그 역할이 크다. 단기적 유동성의 위기를 벗어나는 것만이 아닌 근본적인 개선이 필요하다. 노선 철수와 고용 감소를 할 수 있지만 이는 최후의 수단이 되어야 하고, 우선 불필요한 사업의 개선, 조직 효율성의 강화, 비용과 수익개선을 추진하여야한다. 즉 양적 성장의 시대에서 질적 성장의 계기로 전환이 필요하다.","This study looked at the effects of the COVID-19 pandemic on tourism industry and suggested a way to develop Post-COVID-19 pandemic. Specifically, individual in-depth interviews were conducted with experienced employees at hotels, travel agencies and airlines. Based on the results of the research, the following are suggested measures for the development of the tourism industry in the Post-COVID-19 Pandemic. First, it is important to develop non-face-to-face service products in the untact era. However, due to the nature of the tourism industry, there are difficulties due to the task of making direct contact with customers. As technologies such as 5G, AI, big data and augmented reality rapidly spread due to the acceleration of the fourth industrial revolution since the COVID-19 pandemic, the tourism industry needs to recognize new paradigms and essential structural improvements. First, there is a high possibility that the appearance of the front desk will change from the traditional way to the introduction of an untact payment and automation system. Food and beverage (F&amp;B) should be an open restaurant with low population density, banquets a way of lending venues to small groups, and catering should be promoted as a small group party. Third, the travel industry needs to revitalize the domestic travel industry in the short term and must prepare for the New Normal tourism market, which is completely different from before the COVID-19 pandemic. Fourth, airlines need fundamental improvements, which should push for improvements in unnecessary business, enhanced organizational efficiency and improved costs and profits.",https://www.kci.go.kr/kciportal/ci/sereArticleSearch/ciSereArtiView.kci?sereArticleSearchBean.artiId=ART002598913
48,2020.06,코로나바이러스감염증-19 환자 수술 시 감염관리,,Infection Control during Surgery for Patients with Confirmed or Suspected Coronavirus Disease-19,한시현(단국대학교의과대학부속병원 감염관리팀),,"The prevalence of coronavirus disease (COVID-19) has led to an increase in the number of patients being treated at medical institutions, including the number of patients requiring surgical treatments. Although the operating room infection control has focused on preventing surgical site infections in patients, a high interest has been shown in preventing infections in the medical staff because of a high risk of exposure of the medical staff to body fluids and respiratory system secretions during surgery when operating on suggested or confirmed patients with COVID-19. A thorough surgical preparation by the medical institution is warranted to protect both the patient and medical staff from contracting infections.
The medical institution should closely examine the operation process to maintain the facilities related to the operation and plan the placement of human resources and patient movement. Further, specific guidelines for commodity, environmental, and waste management should be established in accordance with the agency’s situation, and medical workers should be continuously trained using the related guidelines.",https://www.kci.go.kr/kciportal/ci/sereArticleSearch/ciSereArtiView.kci?sereArticleSearchBean.artiId=ART002599571
49,2020.06,코로나19 사태로 비추어 본 반려동물 원격진료 도입 가능성에 대한 법적 고찰,,A Legal Consideration on the Possibility of Introducing Veterinary Telemedicine for the Companion Animal in the light of COVID-19,이진홍(건국대학교 GLOCAL(글로컬)캠퍼스),"코로나19 바이러스는 사람뿐만 아니라 반려동물에도 감염될 수 있다는 가능성이 제기되었고 실제로 미국, 홍콩 등 여러 나라에서 확진자의 반려견에 양성 반응이 나타난 사례가 있었다. 그렇지 않아도 코로나19 사태로 반려동물을 동반하여 외출하는 것이 어려웠던 상황과 겹쳐 반려견에게도 코로나19가 감염될 수 있다는 사실이 확인되어 반려동물 양육자들의 우려가 커지고 있다. 이에 따라 양육자들은 반려동물의 건강에 문제가 생겼을 때 직접 동물병원에 데리고 가기보다는 스마트폰 어플리케이션을 통한 진료상담을 하는 등 차선책을 찾는 방식으로 그들의 반려동물을 케어하고 있다. 그러나 스마트폰 어플리케이션을 이용하는 방식으로는 개별적인 진단에 기반한 진료를 받을 수는 없고 일반적인 진료상담 서비스밖에 받지 못한다는 점에 한계가 있어 안심할 수는 없는 실정이다. 국내법상 동물의 원격진료 행위는 허용되지 않아 IT 서비스를 활용한 진료는 보편적인 경우에 적용할 수 있는 상담의 형식으로 이루어지고 있기 때문이다. 그러나 반려동물의 건강권을 실현하고 원격진료를 시도하려는 국제적 흐름에 뒤처지지 않기 위해서는 동물 원격진료의 도입 가능성을 검토해 볼 필요가 있다. 선행적으로 수의사가 직접 방문을 하거나 동물병원 방문을 통하여 직접적인 진단이 있었던 경우에 한하여 진단을 내렸던 수의사와의 원격진료를 제한적으로 시도하는 방안, 그리고 해당 동물 및 의뢰인이 격오지에 있어 상시적으로 동물병원에 방문하는 것이 어려운 지역에 한하여 제한적인 범위에서 시도하는 방안이 고려된다. 이를 위해서는 동물 치료에 사용하는 의약품을 수의사가 처방할 수 있는 의료체계로 입법적 개선이 선행되어야 하며, 일부 대형 동물병원으로 진료 의뢰가 쏠리는 현상을 대비하여 시행 초기부터 방지대책을 마련하는 방향으로 사전적인 준비가 필요할 것이다.","The spread of COVID-19 virus has raised the possibility that companion animals can also get infected. Indeed, a small number of companion animals have been confirmed to be infected with the virus that causes COVID-19 worldwide and companion animals’ owners have concerned for the safety of their companion animals. As it is difficult to go out with companion animals, various IT services considering the animal rights to health emerged, and people using platforms such as medical consultation through smart phone applications are also increasing. However, there is a limit in that it is only a consultation service for pets and is not an individual diagnosis. This is because the domestic law does not allow animals to receive medical treatment remotely. However, it is necessary to consider the possibility of introducing veterinary telemedicine in order to protect the implementation of animals rights to health and keep pace with global trends. Only in the case of a veterinarian's direct visit or a direct diagnosis through a visit to an veterinary clinic before, limited remote treatment with the veterinarian who made the diagnosis may make an attempt. In addition, it is also possible to conduct veterinary medicine within a limited range only in areas where the animals and clients are in remote areas and have difficulty visiting at all times. Furthermore, legislative improvement is needed as a medical system that veterinarians can prescribe medicines used for animal treatment, and it is necessary to prepare a preventive measure from the beginning of the implementation for a scenario that a request for medical treatment is concentrated in some large veterinary clinics.",https://www.kci.go.kr/kciportal/ci/sereArticleSearch/ciSereArtiView.kci?sereArticleSearchBean.artiId=ART002603696
